<!DOCTYPE rpsl_syntax SYSTEM "syntax.dtd">

<!-- 

file: syntax.xml

description: Defines the various syntaxes that RPSL attributes can have.

$Id: syntax.xml,v 1.1 2004/12/27 16:38:39 can Exp $

-->

<rpsl_syntax>

   <attribute_syntax name="filter-set">
      <core>
          <regex>
              ^.{1,80}$
          </regex>
       </core>
       <front_end>
          <regex>
              ^((AS([1-9][0-9]{0,3}|[1-5][0-9]{4}|6[0-4][0-9]{3}|65[0-4][0-9]{2}|655[0-2][0-9]|6553[0-5])|fltr-[A-Z0-9_-]*[A-Z0-9]):)*fltr-[A-Z0-9_-]*[A-Z0-9](:(AS([1-9][0-9]{0,3}|[1-5][0-9]{4}|6[0-4][0-9]{3}|65[0-4][0-9]{2}|655[0-2][0-9]|6553[0-5])|fltr-[A-Z0-9_-]*[A-Z0-9]))*$
          </regex>
       </front_end>
       <description>
     A filter-set name is made up of letters, digits, the
     character underscore "_", and the character hyphen "-"; it
     must start with "fltr-", and the last character of a name
     must be a letter or a digit.

     A filter-set name can also be hierarchical.  A hierarchical
     set name is a sequence of set names and AS numbers separated
     by colons ":".  At least one component of such a name must
     be an actual set name (i.e. start with "fltr-").  All the
     set name components of a hierarchical filter-name have to be
     filter-set names.
       </description>
   </attribute_syntax>

   <attribute_syntax name="as-set">
       <core>
          <regex>
              ^.{1,80}$
          </regex>
       </core>
       <front_end>
           <regex>
              ^((AS([1-9][0-9]{0,3}|[1-5][0-9]{4}|6[0-4][0-9]{3}|65[0-4][0-9]{2}|655[0-2][0-9]|6553[0-5])|as-[A-Z0-9_-]*[A-Z0-9]):)*as-[A-Z0-9_-]*[A-Z0-9](:(AS([1-9][0-9]{0,3}|[1-5][0-9]{4}|6[0-4][0-9]{3}|65[0-4][0-9]{2}|655[0-2][0-9]|6553[0-5])|as-[A-Z0-9_-]*[A-Z0-9]))*$
           </regex>
       </front_end>
       <description>
     An as-set name is made up of letters, digits, the
     character underscore "_", and the character hyphen "-"; it
     must start with "as-", and the last character of a name must
     be a letter or a digit.

     An as-set name can also be hierarchical.  A hierarchical set
     name is a sequence of set names and AS numbers separated by
     colons ":".  At least one component of such a name must be
     an actual set name (i.e. start with "as-").  All the set
     name components of a hierarchical as-name have to be as-set
     names.
       </description>
   </attribute_syntax>

   <attribute_syntax name="route-set">
       <core>
          <regex>
              ^.{1,80}$
          </regex>
       </core>
       <front_end>
           <regex>
              ^((AS([1-9][0-9]{0,3}|[1-5][0-9]{4}|6[0-4][0-9]{3}|65[0-4][0-9]{2}|655[0-2][0-9]|6553[0-5])|rs-[A-Z0-9_-]*[A-Z0-9]):)*rs-[A-Z0-9_-]*[A-Z0-9](:(AS([1-9][0-9]{0,3}|[1-5][0-9]{4}|6[0-4][0-9]{3}|65[0-4][0-9]{2}|655[0-2][0-9]|6553[0-5])|rs-[A-Z0-9_-]*[A-Z0-9]))*$
           </regex>
       </front_end>
       <description>
     An route-set name is made up of letters, digits, the
     character underscore "_", and the character hyphen "-"; it
     must start with "rs-", and the last character of a name must
     be a letter or a digit.

     A route-set name can also be hierarchical.  A hierarchical
     set name is a sequence of set names and AS numbers separated
     by colons ":".  At least one component of such a name must
     be an actual set name (i.e. start with "rs-").  All the set
     name components of a hierarchical route-name have to be
     route-set names.
       </description>
   </attribute_syntax>

   <attribute_syntax name="peering-set">
      <core>
          <regex>
              ^.{1,80}$
          </regex>
       </core>
       <front_end>
          <regex>
              ^((AS([1-9][0-9]{0,3}|[1-5][0-9]{4}|6[0-4][0-9]{3}|65[0-4][0-9]{2}|655[0-2][0-9]|6553[0-5])|prng-[A-Z0-9_-]*[A-Z0-9]):)*prng-[A-Z0-9_-]*[A-Z0-9](:(AS([1-9][0-9]{0,3}|[1-5][0-9]{4}|6[0-4][0-9]{3}|65[0-4][0-9]{2}|655[0-2][0-9]|6553[0-5])|prng-[A-Z0-9_-]*[A-Z0-9]))*$
          </regex>
       </front_end>
       <description>
     A peering-set name is made up of letters, digits, the
     character underscore "_", and the character hyphen "-"; it
     must start with "prng-", and the last character of a name
     must be a letter or a digit.

     A peering-set name can also be hierarchical.  A hierarchical
     set name is a sequence of set names and AS numbers separated
     by colons ":".  At least one component of such a name must
     be an actual set name (i.e. start with "prng-").  All the
     set name components of a hierarchical peering-set name have
     to be peering-set names.
       </description>
   </attribute_syntax>

   <attribute_syntax name="rtr-set">
      <core>
          <regex>
              ^.{1,80}$
          </regex>
       </core>
       <front_end>
          <regex>
              ^((AS([1-9][0-9]{0,3}|[1-5][0-9]{4}|6[0-4][0-9]{3}|65[0-4][0-9]{2}|655[0-2][0-9]|6553[0-5])|rtrs-[A-Z0-9_-]*[A-Z0-9]):)*rtrs-[A-Z0-9_-]*[A-Z0-9](:(AS([1-9][0-9]{0,3}|[1-5][0-9]{4}|6[0-4][0-9]{3}|65[0-4][0-9]{2}|655[0-2][0-9]|6553[0-5])|rtrs-[A-Z0-9_-]*[A-Z0-9]))*$
          </regex>
       </front_end>
       <description>
     A router-set name is made up of letters, digits, the
     character underscore "_", and the character hyphen "-"; it
     must start with "rtrs-", and the last character of a name
     must be a letter or a digit.

     A router-set name can also be hierarchical.  A hierarchical
     set name is a sequence of set names and AS numbers separated
     by colons ":".  At least one component of such a name must
     be an actual set name (i.e. start with "rtrs-").  All the
     set name components of a hierarchical router-set name have
     to be router-set names.
       </description>
   </attribute_syntax>

   <attribute_syntax name="members-as">
       <front_end>
          <regex>
^((((AS([1-9][0-9]{0,3}|[1-5][0-9]{4}|6[0-4][0-9]{3}|65[0-4][0-9]{2}|655[0-2][0-9]|6553[0-5])|as-[A-Z0-9_-]*[A-Z0-9]):)*as-[A-Z0-9_-]*[A-Z0-9](:(AS([1-9][0-9]{0,3}|[1-5][0-9]{4}|6[0-4][0-9]{3}|65[0-4][0-9]{2}|655[0-2][0-9]|6553[0-5])|as-[A-Z0-9_-]*[A-Z0-9]))*)|AS([1-9][0-9]{0,3}|[1-5][0-9]{4}|6[0-4][0-9]{3}|65[0-4][0-9]{2}|655[0-2][0-9]|6553[0-5]))$
          </regex>
       </front_end>
       <description>
     &lt;as-number&gt; or
     &lt;as-set-name&gt;
       </description>
   </attribute_syntax>

   <attribute_syntax name="members-is">
       <front_end>
           <parser_name>members_is</parser_name>
       </front_end>
       <description>
     &lt;inet-rtr-name&gt; or
     &lt;rtr-set-name&gt; or
     &lt;ipv4-address&gt;
       </description>
   </attribute_syntax>


   <attribute_syntax name="members-rs">
       <front_end>
          <parser_name>members_rs</parser_name>
       </front_end>
       <description>
     &lt;address-prefix-range&gt; or
     &lt;route-set-name&gt; or
     &lt;route-set-name&gt;&lt;range-operator&gt;.
       </description>
   </attribute_syntax>

   <attribute_syntax name="mbrs-by-ref">
       <core>
          <regex>
              ^.{1,80}$
          </regex>
       </core>
       <front_end>
           <regex>
               ^[A-Z]([A-Z0-9_-]*[A-Z0-9])?$
           </regex>
           <!-- note that ANY is not reserved for mbrs-by-ref -->
           <reserved_regex>
               ^(as-any|rs-any|peeras|and|or|not|atomic|from|to|at|action|accept|announce|except|refine|networks|into|inbound|outbound|rs-.*|rtrs-.*|fltr-.*|prng-.*)$
           </reserved_regex>
       </front_end>
       <description>
     &lt;mntner-name&gt; | ANY 
       </description>
   </attribute_syntax>
   
   <attribute_syntax name="free-form">
       <description>
     A sequence of ASCII characters.
       </description>
   </attribute_syntax>

   
   <attribute_syntax name="nic-handle">
       <core>
          <regex>
              ^.{1,30}$
          </regex>
       </core>
       <front_end>
           <regex>
             ^(([A-Z]{2,4}[0-9]{0,6}(-[A-Z]{1,9})?)|(AUTO-[0-9]+([A-Z]{2,4})?))$
           </regex>
       </front_end>
       <description>
     From 2 to 4 characters optionally followed by up to 5 digits
     optionally followed by a source specification.  Source
     specification starts with "-" followed by source name up to
     9-character length.
       </description>
   </attribute_syntax>
   
   <attribute_syntax name="object-name">
      <core>
          <regex>
              ^.{1,80}$
          </regex>
      </core>    
      <front_end>
           <regex>
               ^[A-Z]([A-Z0-9_-]*[A-Z0-9])?$
           </regex>
           <reserved_regex>
               ^(any|as-any|rs-any|peeras|and|or|not|atomic|from|to|at|action|accept|announce|except|refine|networks|into|inbound|outbound|as-.*|rs-.*|rtrs-.*|fltr-.*|prng-.*)$
           </reserved_regex>
       </front_end>
       <description>
     Made up of letters, digits, the character underscore "_",
     and the character hyphen "-"; the first character of a name
     must be a letter, and the last character of a name must be a
     letter or a digit.  The following words are reserved by
     RPSL, and they can not be used as names:
   
      any as-any rs-any peeras and or not atomic from to at
      action accept announce except refine networks into inbound
      outbound
   
     Names starting with certain prefixes are reserved for
     certain object types.  Names starting with "as-" are
     reserved for as set names.  Names starting with "rs-" are
     reserved for route set names.  Names starting with "rtrs-"
     are reserved for router set names. Names starting with
     "fltr-" are reserved for filter set names. Names starting
     with "prng-" are reserved for peering set names.
       </description>
   </attribute_syntax>

   <attribute_syntax name="netname">
      <core>
          <regex>
              ^.{1,80}$
          </regex>
      </core>    
      <front_end>
           <regex>
               ^[A-Z]([A-Z0-9_-]*[A-Z0-9])?$
           </regex>